vid,utter_id,sentence,label
Ses04M_impro06,23,"It'll get better.  I know it doesn't help, but it will get better and you will remember all of the good things that you guys had; all of the memories that you have with him that were happy and you'll be grateful for those.",1
Ses04M_impro06,24,This is just -- this is a terrible life.  I just don't understand.,1
Ses04M_impro06,25,"I mean, it's just not fair.  Like, I don't know.  Why people -",1
Ses04M_impro06,26,"there should just be some sort of rule that people don't die until they're older, 'cause then, at least, it's expected.",1
Ses04M_impro06,27,"I agree.  If I knew how to make that happen, I would certainly help you.",1
Ses04M_impro06,28,I don't know what to do.,1
Ses04M_impro06,29,"When's the service? Can- can we help?  Is there anything, I mean--",1
Ses04M_impro06,30,"I mean, you- you can go.  I don't know.  I don't know what else.",1
Ses04M_impro06,31,I hope it rains.  Somehow that'll make me feel more comfortable.,1
Ses04M_impro06,32,"Seems like if the whole world's sad, then it's okay for you to be.",1
Ses04M_impro06,33,Yeah.,1
Ses04M_impro06,34,I just wish there was some way to just bring him back to life magically.,1
Ses04M_impro06,35,I know.,1
Ses04M_impro06,36,"Just, you know, some thing; some genie. I need to find a genie bottle.",1
Ses04M_impro06,37,"I don't have any magic answers.  But,",1
Ses04M_impro06,38,"I mean, as- as cliche as it is, as long as people who loved him remember him, then it's not a waste, you know.",1
Ses04M_impro06,39,I know.,1
Ses03M_impro05a,0,Can I help you sir?,2
Ses03M_impro05a,1,Yes you can help me.  Where is my luggage?,3
Ses03M_impro05a,2,"Well, let me just check on that for you.  Where are you coming--?",2
Ses03M_impro05a,3,Yeah.  You do that.  I'm coming from Baltimore.  You know where that is?,3
Ses03M_impro05a,4,"Sir, yes it's in Maryland.  It's okay...well, I'm...just let me check here.",2
Ses03M_impro05a,5,I had eight hundred pounds of luggage.,3
Ses03M_impro05a,6,Okay.  Sir?  Can you...if you just give me one moment and let me just check okay?,5
Ses03M_impro05a,7,Okay.  Check.,3
Ses03M_impro05a,8,"Alright.  And you're coming-- Wait, hold on sir.  You're coming from Baltimore into LAX right?",5
Ses03M_impro05a,9,Is it there?,3
Ses03M_impro05a,10,Yes.,3
Ses03M_impro05a,11,Okay and this is direct flight?,2
Ses03M_impro05a,12,You don't know where we're at?,3
Ses03M_impro05a,13,God.,3
Ses03M_impro05a,14,I'm asking you if this is direct flight from Baltimore to LAX or if you have to stop--,5
Ses03M_impro05a,15,You're at me and I'm going to try to help you out sir but you just have to cooperate with me--,2
Ses03M_impro05a,16,Okay.  What do you want?,3
Ses03M_impro05a,17,How many pieces of luggage do you have checked in?,2
Ses03M_impro05a,18,Eight.  And they're all gone.,3
Ses03M_impro05a,19,Eight pieces of luggage.  Okay.,2
Ses03M_impro05a,20,And what are you going to do about it?  You going to call someone?  You going to send me somewhere else?,3
Ses03M_impro05a,21,No.  I'm just going to check--,5
Ses03M_impro05a,22,It's my mother's funeral tomorrow and the urn is in the suitcase.,3
Ses03M_impro05a,23,I'm sorry sir.,2
Ses03M_impro05a,24,Yeah.,3
Ses03M_impro05a,25,I'm very sorry but let's check on this immediately.  This is definitely an emergency.  It seems--,2
Ses03M_impro05a,26,"Oh, oh, that's a good deduction.",3
Ses03M_impro05a,27,Yes--it is,2
Ses03M_impro05a,28,"Sherlock Holmes.  God, where's my luggage?",3
Ses03M_impro05a,29,"Sir, Please please, I would ask you to just calm down for a second--",5
Ses03M_impro05a,30,Calm down?  It's my mother's funeral tomorrow.  I'm the one responsible for this.,3
Ses03M_impro05a,31,"Okay.  We will find your luggage.  Apparently because it somehow...what flight you were taking, you were on Delta?",2
Ses03M_impro05a,32,"Yes, I am.",0
Ses03M_impro05a,33,What is the matter with you?,3
Ses03M_impro05a,34,"Sir, I just...you need to calm down is what needs to happen right now.",3
Ses03M_impro05a,35,Don't yell at me.,3
Ses03M_impro05a,36,"Okay.  I'm not.  I'm sorry, I am being--",5
Ses03M_impro05a,37,"calm.  Sir, okay basically what- what's going to happen here is you're going to give me your contact information and we will contact you--",5
Ses03M_impro05a,38,Oh my God.  I think a blood vessel burst in my head.,3
Ses03M_impro05a,39,"Please, please",2
Ses03M_impro05a,40,What?,3
Ses03M_impro05a,41,Okay.  We can get it here in about seven to ten business days.,2
Ses03M_impro05a,42,What?  Are you kidding me?,3
Ses03M_impro05a,43,"Yes.  Well, because--",2
Ses03M_impro05a,44,Give- Give me your manager right now.,3
Ses03M_impro05a,45,I am the manager sir.,2
Ses03M_impro05a,46,"You're the manager? You don't know where you work for, you don't know where you're at and you're the manager?",3
Ses03M_impro05a,47,Whose daughter are you?,3
Ses03M_impro05a,48,Sir?,5
Ses03M_impro05a,49,Sir. Sir. Sir. Sir,3
Ses03M_impro05a,50,What is your name?,3
Ses03M_impro05a,51,My name is Brent Caption.,3
Ses03M_impro05a,52,Now what are you going to do about it?,4
Ses04M_script03_2,0,That was the first time you ever hit me.,3
Ses04M_script03_2,1,I didn't hit you very hard.,2
Ses04M_script03_2,2,"The manager came in and found us rolling about on the floor, biting and scratching like panthers.  Oh, dear.",0
Ses04M_script03_2,3,"How ridiculous.  How utterly, utterly ridiculous.",0
Ses04M_script03_2,4,And very much sillier.,0
Ses04M_script03_2,5,"As a matter of fact, the real cause of that row was Peter Burden.",5
Ses04M_script03_2,6,I knew nothing of the sort.  You took presents from him.,5
Ses04M_script03_2,7,Not at all.  It was very pretty.  I still have it and I wear it often.,4
Ses04M_script03_2,8,You went out of your way to torture me over Peter Burden.,5
Ses04M_script03_2,9,"You must admit that he was in love with you, wasn't he?",3
Ses04M_script03_2,10,"Just a little, perhaps, nothing serious.",0
Ses04M_script03_2,11,Line?,2
Ses04M_script03_2,12,Let him kiss you.,2
Ses04M_script03_2,13,You let him kiss you.  You said you did.,3
Ses04M_script03_2,14,What of it?,3
Ses04M_script03_2,15,What of it?,3
Ses04M_script03_2,16,What about me?,3
Ses04M_script03_2,17,"If you hadn't been so nosey, you never would have known a thing about it.",5
Ses04M_script03_2,18,"That's a nice point of view, I must say.",3
Ses04M_script03_2,19,"Oh, dear.  I'm bored with this conversation.",5
Ses04M_script03_2,20,So am I; bored stiff.,3
Ses04M_script03_2,21,"No, thanks.",3
Ses04M_script03_2,22,"I'll have a little myself, I think.",5
Ses04M_script03_2,23,I don't see why you want it.  You've already had two glasses.,5
Ses04M_script03_2,24,"No particular reason.  Anyhow, they were very small ones.",5
Ses04M_script03_2,25,It seems so silly to go on and on and on with such a thing.,5
Ses04M_script03_2,26,You can hardly call three liquor glasses in a whole evening going on and on and on.,5
Ses04M_script03_2,27,It's become a habit with you.,3
Ses04M_script03_2,28,You needn't be so grand just because you don't happen to want any at the moment.,5
Ses04M_script03_2,29,"Oh, don't be so stupid.",5
Ses04M_script03_2,30,"Really, Amanda",3
Ses04M_script03_2,31,What?,3
Ses04M_script03_2,32,Nothing.,3
Ses04M_script03_2,33,"Going out somewhere, my dear?",3
Ses04M_script03_2,34,"No, just making myself fascinating for you",5
Ses04M_script03_2,35,Oh.  That reply has broken my heart.,5
Ses04M_script03_2,36,"As a matter of fact, that's perfectly true.",3
Ses04M_script03_2,37,"Oh, no, it isn't.",3
Ses04M_script03_2,38,"Yes, it is.",3
Ses04M_script03_2,39,"Oh, be quiet.",3
Ses04M_script03_2,40,Line?,2
Ses04M_script03_2,41,It's a pity you didn't- It's a pity you didn't have more brandy.,2
Ses04M_script03_2,42,It's a pity you didn't have any more brandy.  It might have made you a little less disagreeable.,3
Ses04M_script03_2,43,It doesn't seem to have worked such wonders with you.,5
Ses04M_script03_2,44,Line?,2
Ses04M_script03_2,45,"Snap.  Oh, snap, snap, snap, like a little adder.",3
Ses04M_script03_2,46,"Adders don't snap, they sting.",3
Ses04M_script03_2,47,"They -- nonsense, they have a little bag of venom behind their fangs and they snap.",3
Ses04M_script03_2,48,They sting.,5
Ses04M_script03_2,49,They snap.,3
Ses04M_script03_2,50,I don't care.  Do you understand?  I don't care.  I don't mind if they bark and roll about like hoops.,3
Ses04M_script03_2,51,"Yes, I did, quite a lot.",3
Ses04M_script03_2,52,"I suppose you let him kiss you a good deal more then, hmm?",3
Ses04M_script03_2,53,Mind your own business.,3
Ses04M_script03_2,54,You must have had a riotous time.,3
Ses04M_script03_2,55,"No restraint at all, very enjoyable.  You never had much anyhow.",3
Ses04M_script03_2,56,You're quite insufferable.  I expected it's because you're drunk.,3
Ses04M_script03_2,57,I'm not in the least drunk.,3
Ses04M_script03_2,58,You always had a weak head.,3
Ses04M_script03_2,59,I think I mentioned once before that I've only had three minute liquor glasses of brandy this whole evening.  That's hardly enough to get a child of two drunk.,5
Ses04M_script03_2,60,"On the contrary, a child of two could get violently drunk on only one glass of brandy.",3
Ses04M_script03_2,61,Very interesting.  And how about a child of four and a child of six and a child of nine?,3
Ses04M_script03_2,62,"Oh, shut up.",3
Ses04M_script03_2,63,"Not very funny, dear.  You'd better have some more brandy.",3
Ses04M_script03_2,64,Very good idea.  I will,3
Ses04M_script03_2,65,You better turn that off I think.,3
Ses04M_script03_2,66,Why?,3
Ses04M_script03_2,67,There aren't any people upstairs.  It's a photographer's studio.,3
Ses04M_script03_2,68,"There are people downstairs, I suppose",3
Ses04M_script03_2,69,"Turn it on again, please.",3
Ses04M_script03_2,70,"Very well, if you insist on being boorish and idiotic.",3
Ses04M_script03_2,71,Turn it off.  It's driving me mad.,3
Ses04M_script03_2,72,Go away.  Go away.  I hate you.,3
Ses04M_script03_2,73,Turn it off.,3
Ses04M_script03_2,74,You are far too temperamental.  Try to control yourself.,3
Ses04M_script03_2,75,We swapped. Listen.,2
Ses04M_script03_2,76,Listen--,3
Ses04M_script03_2,77,"Listen, indeed.  I am sick and tired of listening to you, you damn sadistic bully.",3
Ses04M_script03_2,78,"You're a vile tempered, loosed living",3
Ses04M_script03_2,79,Stop.,3
Ses04M_script03_2,80,wicked little beast. And I- I hope I never see you again as long as live.,3
Ses04M_script03_2,81,Stop.  I hate you.  Do you hear me? You're conceited and overbearing and utterly impossible.,3
Ses04M_script03_2,82,"This is the end.  Do you understand, the end?  Finally and forever.",3
Ses04M_script03_2,83,You're not going like this.,3
Ses04M_script03_2,84,"Oh, yes, I am.",3
Ses04M_script03_2,85,"No, you're not.",3
Ses04M_script03_2,86,"Let go of me.  You're a cruel fiend and I hate and loath you.  Thank God, I discovered in time what you're really like.",3
Ses04M_script03_2,87,Shut up. Shut up.,3
Ses04M_script03_2,88,"You're a mean, evil minded",3
Ses04M_script03_2,89,Marry you again? Huh.,3
Ses04M_script03_2,90,little vampire And I hope to God I never set eyes on you as long as I live.,3
Ses04M_script03_2,91,"Never, never, never.  I'd rather die in torment. Beast brute.",3
Ses04M_script03_2,92,Whore.,3
Ses04M_script03_2,93,Swine.,3
Ses03F_impro08,0,"Hey, you stupid dumb shit machine, give me a fucking operator, huh?",3
Ses03F_impro08,1,"Hello sir, can I help you?",2
Ses03F_impro08,2,I [GARBAGE],2
Ses03F_impro08,3,"Yes, sir, I'm very sorry, but we've had some trouble here.  There's been a lot of calls and the system has-",2
Ses03F_impro08,4,"Sir, please calm down.  There's no reason to use profanity like that.  It's not-",2
Ses03F_impro08,5,"Fine, sorry.  Okay, my phone's been on the fritz for like three days.  I can't get any incoming calls. What- What is going on?",5
Ses03F_impro08,6,"Okay, and this is for Verizon? Your provider?",2
Ses03F_impro08,7,"Well, um- we have a little problem with the system going on.  One of our satellites is down, and I-",2
Ses03F_impro08,8,You know what?  I'm just going to- Patient?  I'm a busy man.,3
Ses03F_impro08,9,"You're going to have to just be patient with us, sir, as we",2
Ses03F_impro08,10,"Well, I know sir, and we all are busy.",2
Ses03F_impro08,11,But I'm going to definitely have to- uh--get your contact information,2
Ses03F_impro08,12,"-have to, have to what?",3
Ses03F_impro08,13,What?  It's my phone.  You can't even call me on it. I don't have another phone.,3
Ses03F_impro08,14,"Okay, well, if you would like, um- we will be turning on the systems in probably about ten hours.",2
Ses03F_impro08,15,What?  Are you kidding me?,3
Ses03F_impro08,16,"Sir, I'm very sorry, but this is the way it is.  This- We have no control over it.  It's going to take-  -but you have to be patient with us.  You can use a calling card.  We will give you a free calling card to use.",2
Ses03F_impro08,17,"Oh, my God.",3
Ses03F_impro08,18,I- I'm going to kill myself right now.,3
Ses03F_impro08,19,A free calling card?,3
Ses03F_impro08,20,"Do you have a land line, sir?",2
Ses03F_impro08,21,"Okay, well, we will send you- We will reimburse you for the amount of minutes that you-",2
Ses03F_impro08,22,-on average would use.,2
Ses03F_impro08,23,"That's it? Okay, yeah.  What else?",3
Ses03F_impro08,24,"And we will probably send you a calling card.  I'm very sorry.  You're just going to have to be patient, sir.",2
Ses03F_impro08,25,"Okay, I need more than this.  Are you going to give me a little bit more?",3
Ses03F_impro08,26,"No, we don't just give you things.  We're- we're-",2
Ses03F_impro08,27,we compensating you for all your-,2
Ses03F_impro08,28,So you take things from me and you expect me just to wait around.,5
Ses03F_impro08,29,"No no, we're not taking anything from you sir.  This is- This is unbeknownst to us.  The problem had just happened.",5
Ses03F_impro08,30,The satellite-is down in your area.,5
Ses03F_impro08,31,"Okay, so you think you're going to-  -get me back some minutes, and that's going to make up for three days of business that I lost?  Okay, great.",5
Ses03F_impro08,32,"No, three days, sir.  It's not three days. It's- It's only been about a day now. Let's not exaggerate.",5
Ses03F_impro08,33,"No, it's been--three days.",5
Ses03F_impro08,34,"Fine, it's been a day.  Okay?",5
Ses03F_impro08,35,Three days?,2
Ses03F_impro08,36,A day?,2
Ses03F_impro08,37,"I don't know, sir.",2
Ses03F_impro08,38,About three million dollars.,2
Ses03F_impro08,39,"Oh, well, I'm sorry about that. Umm- We-",2
Ses03F_impro08,40,"Well, ten hours worth of minutes--",2
Ses03F_impro08,41,is what's going to happen.,2
Ses03F_impro08,42,"Sir,",2
Ses03F_impro08,43,"what I would like what I'm advising you to do now is just to write down all of your problems that you-you feel that--You know, haven't been addressed, fax it to us-",2
Ses03F_impro08,44,"Oh, my God.",5
Ses03F_impro08,45,and we will take care of it if anything happens.  But all we can do now is ask for your patience.,2
Ses03F_impro08,46,Okay? Thank you for calling.  Goodbye.,2
Ses04M_impro07,0,"Alright, so you're not going to believe this.  But I went home today. I looked through the mail.  And I got an acceptance letter from U.S.C..",4
Ses04M_impro07,1,I'm going to U.S.C.. Yeah.,4
Ses04M_impro07,2,"Yeah, yeah.",4
Ses04M_impro07,3,I didn't even,4
Ses04M_impro07,4,know you applied to U.S.C..,4
Ses04M_impro07,5,"I did.  I did. I've -- yeah, I applied to U.S.C..  I mean, it's really expensive but",4
Ses04M_impro07,6,it's a really good school.  So,4
Ses04M_impro07,7,"That's amazing.  I've seen it on TV. Um, Wow.  I mean, well what are you going to major in?  What are you going to do?",4
Ses04M_impro07,8,"Yeah.  I like to know about history, 'cause, you know, it's- it's just so relevant to the present.",0
Ses04M_impro07,9,Right.,4
Ses04M_impro07,10,Yeah.,0
Ses04M_impro07,11,Yes.,4
Ses04M_impro07,12,"And, uh-",0
Ses04M_impro07,13,Is U.S.C. known for its history program?,4
Ses04M_impro07,14,"Um, you know, I don't think so.  But I think that, you know, it's still a private school",0
Ses04M_impro07,15,"and right you know it's still- and then, you know, I mean-",0
Ses04M_impro07,16,I know.  It's a great school and you know,4
Ses04M_impro07,17,"I'm guessing, you know it's like I I checked it out.  And, like, they have a decent history program.",0
Ses04M_impro07,18,It's all about the connections,4
Ses04M_impro07,19,"So -- and like the geology just is awesome.  It rocks, no pun intended. [LAUGHTER]",0
Ses04M_impro07,20,"Oh, you did not just say that.",0
Ses04M_impro07,21,"Um, but, uh- anyway -- yeah, so that's awesome, though, because you live here and then we're not going to be separated by me going to some other school",4
Ses04M_impro07,22,I know.  You're going to be so close.,4
Ses04M_impro07,23,"And, uh, it's just really exciting.  I- You know, I'm -- just I want to- I want to share this special happy moment with you. It's awesome",4
Ses04M_impro07,24,I'm glad you did.,4
Ses04M_impro07,25,"That's great.  I mean, I'm really glad you're not going to go anywhere.  You'll still be here.",4
Ses04M_impro07,26,Everything in LA is twenty minutes away.,4
Ses04M_impro07,27,Give or take. [LAUGHTER],4
Ses04M_impro07,28,Well congratulations.,4
Ses04M_impro07,29,"umm, and I'm going to check out school and get, you know, check out the courses",4
Ses04M_impro07,30,find out all this stuff.  And- and I don't know.  I think I'm going to try to live in a dorm.,4
Ses04M_impro07,31,Yeah.,4
Ses04M_impro07,32,"Ouch.  That's, um -- oh, wow.",2
Ses04M_impro07,33,"But, congrats on the U.S.C. thing.",4
Ses04M_impro07,34,"No, no, I mean, I didn't know -- I didn't know that about you. Um, I feel like --",2
Ses04M_impro07,35,"The -- what, the- I mean--",2
Ses04M_impro07,36,I'll go to basketball games.,2
Ses04M_impro07,37,"Okay.  Well that's cool, too, but like--",2
Ses04M_impro07,38,Maybe some golf matches.,2
Ses04M_impro07,39,"Wow, you are a winner and a half. [LAUGHTER]",4
Ses04M_impro07,40,I don't know.  Do they have golf?  Do they have- Does U.S.C. have a -- I don't know if they have a golf team.,2
Ses04M_impro07,41,"No, I'm not going to go to a football game.",2
Ses04M_impro07,42,Forget it. Forget it. Forget it. No way.,2
Ses04M_impro07,43,I do -- I will need to get a gun-,2
Ses04M_impro07,44,"Okay.  Um, but, no, I, uh, I do need to get a gun soon, though, 'cause I mean",2
Ses04M_impro07,45,Excuse me?,2
Ses04M_impro07,46,I need to get like a -- just a small little gun just 'cause -- or like a taser or something or just like a butterfly knife,2
Ses04M_impro07,47,No.,2
Ses04M_impro07,48,"'cause, you know, I mean, it's like If I ever want to go south of campus",2
Ses04M_impro07,49,Well I need to defend myself from,2
Ses03F_script01_1,0,He saw it.,2
Ses03F_script01_1,1,He was out there when it happened.,2
Ses03F_script01_1,2,"Um, about four this morning. Uh- I heard a crack and I looked out and I saw him standing there.",2
Ses03F_script01_1,3,I don't know. But after it cracked he went back in the house and he cried in the kitchen.,2
Ses03F_script01_1,4,Did you talk to him?,2
Ses03F_script01_1,5,"No, I uh-, I figured the best thing to do was to leave him alone.",2
Ses03F_script01_1,6,"He cried hard, huh?",2
Ses03F_script01_1,7,I could hear it right through the floor.,2
Ses03F_script01_1,8,I guess he is.,2
Ses03F_script01_1,9,"Could he-he's acting just like he did after he died, you know?",2
Ses03F_script01_1,10,I don't know.,2
Ses03F_script01_1,11,"But I know one thing, mom. We've made a terrible mistake with dad.",2
Ses03F_script01_1,12,Being dishonest with him. That kind of thing always pays off and now it's paying off.,2
Ses03F_script01_1,13,"What do you mean, dishonest?",2
Ses03F_script01_1,14,"What, you're going to argue with him?",5
Ses03F_script01_1,15,"No, I don't want to argue with him, but it's time that he realized that no one believes that Larry's coming back anymore.",5
Ses03F_script01_1,16,You can't tell him that.,5
Ses03F_script01_1,17,We got to tell him that.,5
Ses03F_script01_1,18,We can't. It just won't work.,5
Ses03F_script01_1,19,"You know, for God's sakes it's been three years. No one comes back after three years. It's insane.",5
Ses03F_script01_1,20,They do come back.,2
Ses03F_script01_1,21,"All right. Just- Sit down, mom. I want to talk to you.",5
Ses03F_script01_1,22,"It's those Goddamn newspapers, you know? I mean, it's like every day they come out with this new person that comes along. And the next one's going to be Larry.",3
Ses03F_script01_1,23,"All right. All right. Just come on, sit down.",5
Ses03F_script01_1,24,What?,5
Ses03F_script01_1,25,"You know-you know why I asked Annie here, right?",2
Ses03F_script01_1,26,Why?,2
Ses03F_script01_1,27,You know.,2
Ses03F_script01_1,28,I want to ask her to marry me.,2
Ses03F_script01_1,29,"Well, that's only your business, Chris.",2
Ses03F_script01_1,30,"Come on, you know that's not only my business.",5
Ses03F_script01_1,31,"Well, it is. I mean, what do you want me to do? You're grown up; you know what's going on in your mind.",5
Ses03F_script01_1,32,So it's all right. I'll just go ahead with it.,2
Ses03F_script01_1,33,"Well, you better make sure your father's not- No- I'm just saying.",5
Ses03F_script01_1,34,"See, then it's not just my business. God, you have",3
Ses03F_script01_1,35,"-Oh, you infuriate me sometimes. You know, it's not just my business too if dad throws a fit.",3
Ses03F_script01_1,36,"Yeah, well I ignore what I got to ignore.",5
Ses03F_script01_1,37,And she-she's Larry's girl.,5
Ses03F_script01_1,38,"Well, from your father's point of view she is. I mean, he's still alive. You've got no right to take her.",5
Ses03F_script01_1,39,"'Cause listen, I'm telling you, I don't know where to go from there. Do you?",5
Ses03F_script01_1,40,What do you want from me?,5
Ses03F_script01_1,41,"Every time I reach out for something I have to pull back because other people will suffer. My whole entire life, time and time after time.",1
Ses03F_script01_1,42,You're a considerate fella and there's nothing wrong in that.,2
Ses03F_script01_1,43,To hell with that.,3
Ses03F_script01_1,44,There's nothing wrong with it.,2
Ses03F_script01_1,45,I didn't ask Annie yet.,2
Ses03F_script01_1,46,You didn't ask her yet?,5
Ses03F_script01_1,47,I wanted to get this settled first.,2
Ses03F_script01_1,48,Well then I guess it's over then. But from her letters I think she's forgotten him.,2
Ses03F_script01_1,49,"I'll find out. But then after it's all over we'll thrash it out with dad, right?",2
Ses03F_script01_1,50,"Mom, don't avoid me.",5
Ses03F_script01_1,51,"You know, the trouble is you've never had enough women. No, you never did.",5
Ses03F_script01_1,52,So what? I'm not fast with women.,5
Ses03F_script01_1,53,I don't understand why it has to be her.,5
Ses03F_script01_1,54,Because it is.,2
Ses03F_script01_1,55,"That's a good answer, but it doesn't answer anything.",5
Ses03F_script01_1,56,I just-,5
Ses03F_script01_1,57,"I mean, you haven't seen her since the war. I mean, it's been five years.",5
Ses03F_script01_1,58,It just is. I-,2
Ses03F_script01_1,59,"I grew up with her. Okay. All these years, when I think of someone I want to be my wife I think of Annie. What do you want, a diagram?",5
Ses03F_script01_1,60,"No, I don't want a diagram.",5
Ses03F_script01_1,61,"He thinks he's coming back. You go-go on and marry her, I mean, you're pronouncing her dead. And what's going to happen to your father, huh? I don't know. Do you?",5
Ses03F_script01_1,62,"Okay. All right, then.",5
Ses03F_script01_1,63,"Just, listen. Give it more thought, is all.",5
Ses03F_script01_1,64,"No, I've given it three years of thought.",5
Ses03F_script01_1,65,But if I can't have that here then I'll get out.,2
Ses03F_script01_1,66,I'll get out. I'll marry her somewhere else. Maybe New York.,2
Ses03F_script01_1,67,You're what-you're going to leave the business? But you can't do that. What the hell is this?,5
Ses03F_script01_1,68,The business. The business doesn't inspire me.,5
Ses03F_script01_1,69,"Oh, you have to be inspired.",5
Ses03F_script01_1,70,Yes. I like it an hour out of the day. If I have to grub for money all day long at least that evening I want it beautiful. I want a wife. I want a family. I want some kids. I want to build something I can give myself to.,3
Ses03F_script01_1,71,"Now, Annie's in the middle of all that.",3
Ses03F_script01_1,72,"Now, where do I find it?",2
Ses03F_script01_1,73,Tell me something.,2
Ses03F_script01_1,74,You'd leave that business.,2
Ses03F_script01_1,75,Yes. On this I would.,2
Ses03F_script01_1,76,You can't do that.,5
Ses03F_script01_1,77,Then help me stay here.,2
Ses03F_script01_1,78,"All right, but you can't do that. You can't talk like that.",5
Ses03F_script01_1,79,Okay. Just-,2
Ses03F_script01_1,80,"We've worked all our lives for you. Only for you, Chris. The whole shootin' match is for you.",5
Ses03F_script01_1,81,"Yeah, I know, I know, just help me stay here, all right?",5
Ses03F_script01_1,82,I'm going to.,2
Ses03F_script01_1,83,I am thinking like that.,2
Ses03F_script01_1,84,"I don't know you, do I?",2
Ses03F_script01_1,85,"No, you don't. I'm a pretty tough guy.",2
Ses03F_script01_1,86,Yeah. I can see that.,2
Ses01F_impro04,0,"Have you tried, uh, Craig's List?",2
Ses01F_impro04,1,"Uh, what?  Craig's List?  Oh the internet thing?",2
Ses01F_impro04,2,Yeah.,2
Ses01F_impro04,3,I don't know.  Isn't that-- that's all like escort services and things like that.,2
Ses01F_impro04,4,No.  There's regular jobs on there.,2
