vid,utter_id,sentence,label
Ses04F_script03_2,18,Just making myself fascinating for you.,5
Ses04F_script03_2,19,The woman's job is to allure the man.  Watch me a minute will you.,5
Ses04F_script03_2,20,"Oh, no it isn't",5
Ses04F_script03_2,21,It doesn't seem to have worked such wonders with you.,3
Ses04F_script03_2,22,"Snap, snap, snap like a little adder.",5
Ses04F_script03_2,23,Adders don't snap they sting.,3
Ses04F_script03_2,24,They sting.,3
Ses04F_script03_2,25,"I don't care, okay.  Do you understand?  I don't care.  I don't mind if they bark and roll about like hoops.",3
Ses04F_script03_2,26,Did you see much of Peter Burden after our divorce?,2
Ses04F_script03_2,27,"Yes, I did quite a lot.",3
Ses04F_script03_2,28,Mind your own business.,3
Ses04F_script03_2,29,You're quite insufferable.  I expect it's because you're drunk.,3
Ses04F_script03_2,30,I'm not in the least drunk.,3
Ses04F_script03_2,31,You always had a weak head.,3
Ses04F_script03_2,32,I think I mentioned once before that I had three minute liquor glasses of brandy the whole evening long.  A child of two couldn't get drunk on that.,5
Ses04F_script03_2,33,"On, the contrary.  A child of two could get violently drunk on only one glass of brandy.",3
Ses04F_script03_2,34,"Oh, shut up.",3
Ses04F_script03_2,35,"Not very funny, dear.  You'd better have some more brandy.",3
Ses04F_script03_2,36,Very good idea.  I will.,3
Ses04F_script03_2,37,Why?,3
Ses04F_script03_2,38,There is no one upstairs.  It's a photographer's studio.,3
Ses04F_script03_2,39,There are people downstairs I suppose.,3
Ses04F_script03_2,40,This is no time of year for Tunis.,3
Ses04F_script03_2,41,Very well if you insist on being boorish and idiotic.,3
Ses04F_script03_2,42,Turn it off.  It's driving me mad.,3
Ses04F_script03_2,43,You're far too temperamental.  Try to control yourself.,3
Ses04F_script03_2,44,"Go away, go away.  I hate you.",3
Ses04F_script03_2,45,"Amanda, listen.",3
Ses04F_script03_2,46,Listen? Listen indeed.  I'm sick and tired of listening to you.  You damn sadistic bully.,3
Ses04F_script03_2,47,Stop.,3
Ses04F_script03_2,48,Very amusing.,3
Ses04F_script03_2,49,"Stop, stop.  I hate you.  Do you hear?  You're conceited and overbearing and utterly impossible.",3
Ses04F_script03_2,50,"You're a vile tempered, loose living, wicked little beast. And I hope I never see you again as long as I live.",3
Ses04F_script03_2,51,"This is the end do you understand?  The end,",3
Ses04F_script03_2,52,You're not going like this.,3
Ses04F_script03_2,53,finally and forever,3
Ses04F_script03_2,54,"Oh, I am.  Let go of me.",3
Ses04F_script03_2,55,You're not.,3
Ses04F_script03_2,56,"Oh, I hate you. It's a good thing that I found out in time what you're really like. Marry you again?  Never, never, never.",3
Ses04F_script03_2,57,Shut up.  Shut up. I wouldn't marry you again if you came crawling to me on your bended knees.,3
Ses04F_script03_2,58,"You're a mean, evil minded, little tempered witch. I hope to God I never set eyes on you again as long as I live. Whore.",3
Ses04F_script03_2,59,I'd rather die in torment. Beast.  Brute.  Calf swine.,3
Ses01F_impro07,0,Did you get the letter?,4
Ses01F_impro07,1,"Yes.  There's a big envelope it says, you're in. I know.",4
Ses01F_impro07,2,Yeah. That is so awesome.,4
Ses01F_impro07,3,Oh my God. What are you going to do? [LAUGHTER],4
Ses01F_impro07,4,"Oh-Yeah, I bet you're really excited. Oh.  That's what loans are for?  Right? Exactly.",4
Ses01F_impro07,5,"I'm really excited.  Yeah. I don't know how I'm going to pay for anything, but... I also- Yeah.  Loans, too, yeah. I applied, though, for a bunch of grants and scholarships so I'm still waiting to hear on that.",4
Ses01F_impro07,6,"Oh.  Good, good.  That's awesome. Are you going to stay around here?  Or are you going to like get a different neighborhood- you going to move to a different neighborhood?",4
Ses01F_impro07,7,"Oh- I know, I know, I know, I know.",4
Ses01F_impro07,8,"I don't know.  I spend so much time commuting as it is, I'd rather.",4
Ses01F_impro07,9,This is so- I am so happy that you're going to stay.  You're not going to...We should totally throw a party.,4
Ses01F_impro07,10,I know. We should throw a party.,4
Ses01F_impro07,11,A rapper party ho. Yeah. Okay.,4
Ses01F_impro07,12,"I am just- Yeah.  I'm sticking around, I'm just doing my thing.  I'm living here.  I'm so glad you're going to stay, I'm so glad you're going to be here. Yeah. Woo.",4
Ses01F_impro07,13,It's a relief too. I mean I was thinking I was going to have to pack up all of my stuff but yeah. Hooray for U.S.C.,0
Ses01F_impro07,14,Yeah.  Big time.,4
Ses01F_impro07,15,Mmhmm. Mmhmm. Yay. So what major?  What are you doing?,4
Ses01F_impro07,16,Yeah.  I'm not sure.,4
Ses01F_impro07,17,Is this a Masters or a P.h.D.?  Or can you...? Nice,2
Ses01F_impro07,18,Umm...P.h.D. [LAUGHTER],4
Ses01F_impro07,19,"That's good.  Don't you have to like teach a class, too, when you do that?",2
Ses01F_impro07,20,"Teacher. Mrs. Nash, I have a question.",4
Ses01F_impro07,21,So I get to mold young minds. Mrs.?  That's my mother.,4
Ses01F_impro07,22,You have to get married.  Well you are married to Chuck.  You're Mrs. Nash.  Not to be confused with Mrs. Dash which is the popular seasoning.,4
Ses01F_impro07,23,"I would be like- Oh. Right, right, right.",4
Ses01F_impro07,24,Yay...School's fun.,4
Ses01F_impro07,25,"Of course, right.  That's where the real money is, being a student.",2
Ses01F_impro07,26,That's how you get the big bucks.  Are you messing with the chair? Don't ruin it.,0
Ses01F_impro07,27,"I know. I made such a mess of it, the entire time.  The last three things I've done, I've ruined everything, I think. Mm-hmm.  Yeah.",4
Ses01F_impro02,0,Did you get the mail? So you saw my letter?,1
Ses01F_impro02,1,Yeah.  I know.,1
Ses01F_impro02,2,"I don't understand.  You've already done so much, I don't know why do you have to go back.",1
Ses01F_impro02,3,I don't know.  I put in that. request too. They didn't...,1
Ses01F_impro02,4,"I guess, you know, everybody has to make sacrifices.",2
Ses01F_impro02,5,"There's people that have given more though, you know?",1
Ses01F_impro02,6,I just don't see how they can make you leave when you have a new baby - we have a new kid.,5
Ses01F_impro02,7,I know.,1
Ses01F_impro02,8,"There's babies over there, though, that need mothers.",2
Ses01F_impro02,9,I don't know how you can be okay with this?  I don't know why you're not-- you're fine with it.,1
Ses01F_impro02,10,"Just, you know, kicking myself.",1
Ses01F_impro02,11,things just aren't what they seem.,1
Ses01F_impro02,12,I know.,5
Ses01F_impro02,13,I just don't see why it has to be you.,1
Ses01F_impro02,14,"If not me then, who?",1
Ses01F_impro02,15,What am I going to do? Huh?,1
Ses01F_impro02,16,"You'll videotape everything, yeah?",1
Ses01F_impro02,17,Yeah.,1
Ses01F_impro02,18,"Maybe you can send it to me, like stream it, yeah?",1
Ses01F_impro02,19,Don't you guys have access to computers over there.,2
Ses01F_impro02,20,Last month--  Yeah.,1
Ses01F_impro02,21,I just don't know how I'm going to do it without you.,1
Ses01F_impro02,22,I have to find sitters.,2
Ses01F_impro02,23,I can't raise a baby by myself.  How?,1
Ses01F_impro02,24,"We've got friends, that's why we moved here, huh?  Because there is a day care down the street.",1
Ses01F_impro02,25,I know.,2
Ses01F_impro02,26,And your mother is close by.,2
Ses01F_impro02,27,I'll send you lots of letters.,1
Ses01F_impro02,28,And I want lots and lots and lots of pictures.,1
Ses01F_impro02,29,It's just not fair.,5
Ses01M_impro02,0,"Hey, Joy come in here.",2
Ses01M_impro02,1,What's happening?,2
Ses01M_impro02,2,I have to go back.,1
Ses01M_impro02,3,I just got a letter I have to go back.,1
Ses01M_impro02,4,First thing tomorrow morning.,1
Ses01M_impro02,5,How...,5
Ses01M_impro02,6,How can they do that?,5
Ses01M_impro02,7,They said you're home for at least four years.,5
Ses01M_impro02,8,"I guess they can do it,",5
Ses01M_impro02,9,"The National Guard is I guess really spread thin and then everyone has to go.  We all have to go back, my whole companies going back.",1
Ses01M_impro02,10,[BREATHING],5
Ses01M_impro02,11,That's not fair.,5
Ses01M_impro02,12,"So yeah, we leave tomorrow...",1
Ses01M_impro02,13,[BREATHING],5
Ses01M_impro02,14,...we're all shipping out.,1
Ses01M_impro02,15,I just got I feel like I'm in shock actually.,1
Ses01M_impro02,16,I don't even know what to tell you.,1
Ses01M_impro02,17,I don't know.,1
Ses01M_impro02,18,What about the birthday party?,1
Ses01M_impro02,19,I guess you're just going to have to have it without me.,1
Ses01M_impro02,20,"Hey listen, it's going to be okay though, all right?",1
Ses01M_impro02,21,You're going to be fine.,1
Ses01M_impro02,22,"I'm going to be fine too, okay?",1
Ses01M_impro02,23,I know I have a good... I have a really good group of guys with me.,1
Ses01M_impro02,24,We're going to be okay.,1
Ses01M_impro02,25,You're going with the same ones?,1
Ses01M_impro02,26,Do promise me you're going to take a lot of pictures.,1
Ses01M_impro02,27,I know.,1
Ses01M_impro02,28,It's not the same though.,1
Ses01M_impro02,29,I just wish there was something I could do.,1
Ses01M_impro02,30,Run away?,1
Ses01M_impro02,31,Mm hmm.  We'll build a bunker and never come out.,1
Ses01M_impro02,32,"I really don't want to go, I don't want to go...",1
Ses01M_impro02,33,Don't say that.,1
Ses01M_impro02,34,I love you.,1
Ses04F_impro03,0,I have something to tell you.,4
Ses04F_impro03,1,What?  You seem so excited.,2
Ses04F_impro03,2,It's really exciting.  Don't you want to guess?,4
Ses04F_impro03,3,"Uh, you got a new car, a new house. Uh, a dog.",2
Ses04F_impro03,4,Look.,4
Ses04F_impro03,5,Yes.  He finally proposed.  I'm getting married.,4
Ses04F_impro03,6,Holy shit that's amazing.,4
Ses04F_impro03,7,I know. I'm so-,4
Ses04F_impro03,8,Congratulations.,4
Ses04F_impro03,9,Thank you. [LAUGHTER],4
Ses04F_impro03,10,"I'm invited, right.",4
Ses04F_impro03,11,You think. [LAUGHTER],4
Ses04F_impro03,12,"Well actually we were just talking about today and I don't really want to do like the traditional church thing, you know.  So we are going to get married in the meadow.",4
Ses04F_impro03,13,We're going to get married in the middle of a meadow. [LAUGHTER],4
Ses04F_impro03,14,"Everybody's going to come up. We're going to stay in all the pretty cabins up there and, um, everybody's going to have, you know, really flowery sort of naturey stuff.",0
Ses04F_impro03,15,So pretty.,4
Ses04F_impro03,16,Very Midsummer Night's wedding.,0
Ses04F_impro03,17,Thanks. Thanks a lot.  You're really helping the Excitement here. I hope no one dies.,4
Ses04F_impro03,18,"Okey Well- well-, you know what?  I was hoping that you would help",4
Ses04F_impro03,19,plan everything.  So then you can make sure that no one gets attacked by bears.,4
Ses04F_impro03,20,Yeah.  I'll help plan.,4
Ses04F_impro03,21,Yeah?,4
Ses04F_impro03,22,Really?,4
Ses04F_impro03,23,"Okay.  It's going to be in, like, six months.  So we don't have a really long time.",4
Ses04F_impro03,24,Why not browns?,2
Ses04F_impro03,25,"It's a light brown, tanish.",2
Ses04F_impro03,26,I just think browns are really what you want to go with.  I mean I think there's more contrast between brown and green than there is-,2
Ses04F_impro03,27,I know but you just asked me to-,2
Ses04F_impro03,28,"Come on.  Please will you do the greens and browns, just the browns for me?",5
Ses04F_impro03,29,Okay.  Fine.  So green and what?,2
Ses04F_impro03,30,Blue?,2
Ses04F_impro03,31,"Okay, fine. Greens and blues.",2
Ses04F_impro03,32,Greens and blues and maybe a little light yellow?,2
Ses04F_impro03,33,Yeah?,2
Ses04F_impro03,34,"Throw in a little- little, uh, trim in yellow.  Maybe some yellow flowers.",4
Ses04F_impro03,35,"Okay.  That sounds good. Um, and, uh, we're going to get like a five, uh, story cake, right?",2
Ses04F_impro03,36,"I mean, you know, you're going to have at least, like, two hundred and fifty people come.  So we're going to need, you know, just a huge buffet.",2
Ses04F_impro03,37,Yes.,4
Ses04F_impro03,38,"Fried chicken, mashed potatoes.",2
Ses04F_impro03,39,because you're going to take care of everything.  You're going to think of all the details that I forget.,4
Ses04F_impro03,40,Well I can't be in charge of this.  I mean I got things I got to do.,2
Ses04F_impro03,41,Well this is really exciting.  I mean- I just- I couldn't be happier right now.,4
Ses04F_impro03,42,I'm thrilled.  God.,4
Ses04F_impro03,43,Ha ha ha.,4
Ses04F_impro03,44,Ha ha.,4
Ses04F_impro03,45,Just ecstatic.  I can't believe you're my best friend,4
Ses04F_impro03,46,Just couldn't be any cooler.,4
Ses04F_impro03,47,"You're my best friend, we're growing up and now you're getting married. that's amazing",4
Ses04F_impro03,48,I know.  I've been waiting forever.  I can't believe it's finally happening.,4
Ses04F_impro03,49,Wow.  I just- I- I- I feel like I'm going to faint.,4
Ses04F_impro03,50,I'm so- all the blood,4
Ses04F_impro03,51,You don't look like you're going to faint.,4
Ses04F_impro03,52,"has just rushed to my head, and I, and I mean honestly.",4
Ses04F_impro03,53,I'm getting a little weak in the knees.,4
Ses04F_impro03,54,So- So when are you getting married Mr. Excited?,4
Ses04F_impro03,55,You haven't ruined it yet.,4
Ses04F_impro03,56,You really like,4
Ses04F_impro03,57,"I don't know.  Okay.  I mean gosh.  There's just- look there's a lot of pressure in getting married, okay.",2
Ses04F_impro03,58,You could make her that excited.  You really like her.  You guys have been together for a really long time now.,4
Ses04F_impro03,59,[LAUGHTER] That's more than I needed to know.,4
Ses04F_impro03,60,[laughter],4
Ses03M_script02_1,0,"Hey, what time is it?  This pokes around midnight right?  God this is great isn't it?",4
Ses03M_script02_1,1,Look at the night we got.  I wouldn't trade this for anything.,4
Ses03M_script02_1,2,You know actually I wanted to go a little further up the coast and get away from all the lights and people but I was afraid you'd miss it.  How are you doing?,4
Ses03M_script02_1,3,"Is that, is that, nah, is that just Paul?  I can't even tell.",4
Ses03M_script02_1,4,"But if I can't tell, it probably isn't them isn't it?  Probably would be unmistakable wouldn't you think?  How are you doing?",4
Ses03M_script02_1,5,"Oh, you know what I forgot?  I forgot my flashlight.  How could I be so stupid?  I should've brought my flashlight.",4
Ses03M_script02_1,6,Yes.,2
Ses03M_script02_1,7,"God.  Oh, you know what would be good right about now?  A six-pack.  A six-pack would be just the ticket.",4
Ses03M_script02_1,8,"I'm so stupid, I should've brought a six-pack.  God, I'm like a little kid.  It's amazing I get out of the house with my fly zipped up. Oh- [LAUGHTER]",4
Ses03M_script02_1,9,I wonder if they can hear us talk?  Or feel the vibrations in the sand when we move around?,4
Ses03M_script02_1,10,Do you want my jacket?,2
Ses03M_script02_1,11,"It's past eleven, let's go.",5
Ses03M_script02_1,12,There is no point in coming down here.,5
Ses03M_script02_1,13,That's my point.,5
Ses03M_script02_1,14,That's my point too...No.  No.  That's not my point.  My point is what's the point if we come down here if we just turn around and leave?,5
Ses03M_script02_1,15,"Honey, this is a natural phenomenon.  It only happens once a year.  I mean think about the people in Kansas, they would have to get hotel reservations and plane tickets to come and see this.  We're only forty minutes away.  This is too good to pass up.",4
Ses03M_script02_1,16,"Pass up what?  These fish swim up to shore, on the beach and then they flop around a little, they swim away and then they die.",5
Ses03M_script02_1,17,"Well this is like the highlight, the one night of their lives and that flopping around, that's laying eggs or spawning or mating or whatever you call it.",4
Ses03M_script02_1,18,"But this is the big night for these guys.  Their last, life's last orgy.",4
Ses03M_script02_1,19,Yeah they do.,4
Ses03M_script02_1,20,Augie.,5
Ses03M_script02_1,21,"Okay.  But it's fish that do something that no other fish do.  Like the swallows in Capistrano or the Lemmings that throw themselves off the cliffs, there's magic here and some mystery and a little bit of unexplainable.",4
Ses03M_script02_1,22,I'm just not.,2
Ses03M_script02_1,23,"You also could remember that I got sand in my panties, we got in an argument over nothing, you got a sore throat and we didn't even get to see the Grunions.",5
Ses03M_script02_1,24,You didn't see them the first time either.,5
Ses03M_script02_1,25,"We just weren't in the good spot.  This is a much better spot.  You know, I have a good instincts for these things.",5
Ses03M_script02_1,26,"Look, is that...no is that just seaweed?",4
Ses03M_script02_1,27,"You know, this is great isn't it?  You know, I wouldn't trade this for anything.",4
Ses03M_script02_1,28,"I mean, think about this, I know you're not interested but just think about this for a minute.",4
Ses03M_script02_1,29,"Somewhere out there, there's this huge silver mass of fish heading this way, they don't why, we don't know why, they just some little instinctual fire cracker went off in their bodies...",4
Ses03M_script02_1,30,"...like and they all just turned at once and formed a line as long as the California coast and started swimming this way.  They didn't, you know, they didn't make a decision, they didn't, you know, have boats or anything.  No one sent them an invitation or a map, they just started swimming as if that's the only thing that matters.",4
Ses03M_script02_1,31,"It's single mindedness with no mind.  It's urgency that's pure urge and they don't, they don't ask it a question, they don't give it a name, they just swim.",4
Ses03M_script02_1,32,They just start swimming to this place right here where we stand for massive celebration of sex and death.,4
Ses03M_script02_1,33,"Oh, I'm giving myself goose bumps.  Look, all my hairs are standing up.",4
Ses03M_script02_1,34,[BREATHING] So what do you think?,4
Ses03M_script02_1,35,About what I just said?,4
Ses03M_script02_1,36,It certainly is not.  It's,5
Ses04F_impro04,0,That's helpful.,2
Ses04F_impro04,1,I just don't think I can do this anymore.  It's been a really long time and it's not like I'm not trying.,5
Ses04F_impro04,2,Well I guess you're not trying hard enough.,2
Ses04F_impro04,3,I am try-  it's been three years,5
Ses04F_impro04,4,and I have gone everywhere I can think of.  I have given resumes.  I have done interviews.  I've tried to pull in favors.  I've asked everybody I know for help.  I don't know what else to do.,5
Ses04F_impro04,5,"Just, I don't know, maybe you're not smart enough.",2
Ses04F_impro04,6,I mean I don't know just go out and keep trying. Just-,2
Ses04F_impro04,7,I don't know.,2
Ses04F_impro04,8,"Okay but I've been trying for three years.  Three years and I haven't gotten a bite much less actually gotten hired, and I am smart enough.  Thank you very much.",5
Ses04F_impro04,9,"Hey.  Look, I mean- you know.",2
Ses04F_impro04,10,I'm really good at what I do.  I just don't know how to make someone else see that.,3
Ses04F_impro04,11,Look bananas don't grow overnight.  Okay.,2
Ses04F_impro04,12,What?  Who says that?  Bananas don't grow overnight.,3
Ses04F_impro04,13,You need that- Time-,2
Ses04F_impro04,14,"You know- You need to just- you need, I mean it takes time to get a good job.  I mean-",2
Ses04F_impro04,15,Okay.  I think three years is a little excessive.,5
Ses04F_impro04,16,"look at me, like, you know. I mean, Hey, I- it took me, you know, like six years to get where I am now. I mean-",2
Ses04F_impro04,17,"Yeah but you weren't unemployed for three years trying to find any job.  I mean at this point I'm going to go drive a cab or, you know, work at the gas station or something.  I don't even- I don't know what to do anymore.",3
Ses04F_impro04,18,I don't know.  I mean whatever.,5
Ses04F_impro04,19,Nothing I'm trying seems to work. Just-,5
Ses04F_impro04,20,Clearly everything you're doing is completely wrong.,3
Ses04F_impro04,21,"I mean, well I mean i don't know; it doesn't really affect my life, you know.",2
Ses04F_impro04,22,Well don't you understand that this is-,5
Ses04F_impro04,23,"Yeah, I understand, but-",2
Ses04F_impro04,24,I don't even- I mean you have to have some kind of an idea.  Something you could possibly throw out there that I could maybe use.,3
Ses04F_impro04,25,"I don't know. Well like, I don't know. I mean-",2
Ses04F_impro04,26,I mean it's not like this is an,3
Ses04F_impro04,27,extreme request.  I want to find a job.  Everybody wants to find a job. It's really not that.,3
Ses04F_impro04,28,Clearly- cle- clearly you're doing something wrong.,2
Ses04F_impro04,29,"Okay. Okay, Fine.",3
Ses04F_impro04,30,"'Cause if you've been looking, you've been applying for jobs for three years. And-",2
Ses04F_impro04,31,Okey So I'm doing something wrong.  What am I doing wrong?,3
Ses04F_impro04,32,I'm really good at what I do.  I'm smart.  I'm trained.  I have the education.  I'm talented.  I cannot-,3
Ses04F_impro04,33,Are you- I mean do you like get dressed up and everything when you go to the job interview?,2
Ses04F_impro04,34,Well yeah I mean I like take a shower and stuff.,5
Ses04F_impro04,35,"And you like- you know, you shave your legs and everything?",2
Ses04F_impro04,36,[LAUGHTER] Yeah.  Usually.,5
Ses04F_impro04,37,"and I want- I mean you know you've got to, like, do your hair.  I mean- I don't know, it's like,",2
Ses04F_impro04,38,"Yeah, I- I make my",5
Ses04F_impro04,39,I make myself very presentable before I go to any kind of interview.,5
Ses04F_impro04,40,"you know what I mean? You know, it's like they say presentation is, like eighty percent.",2
Ses04F_impro04,41,or some- some large percent of- of success.,2
Ses04F_impro04,42,"Uhuh. Uhuh. Yeah, yeah. Good quote.",5
Ses04F_impro04,43,"Because I don't know I mean just, you know, just keep- keep- keep at it.  Keep trying.  Go-",2
Ses04F_impro04,44,Buck-O. That's really helpful.  Just keep chugging along.  The little engine that could.,5
Ses04F_impro04,45,Well you- just you're doing something wrong.,3
Ses04F_impro04,46,"Look if I could give you a job,if I could give you a job I would but I mean I'm not in that position. I'm-",5
Ses04F_impro04,47,Well maybe you could help.  I mean you've got a job.  I'm willing to look outside of my realm.  I could try something else.,5
Ses04F_impro04,48,"Hey, I'd love to help you but I- you don't have the kind of training that I-",2
Ses04F_impro04,49,I'll get it.  I just need a job.  I don't care what it is.,5
Ses04F_impro04,50,"So, go to McDonalds.",5
Ses04F_impro04,51,Well I mean I need to make a little bit more than the minimum wage fry flipper.,5
Ses04F_impro04,52,Well you've got to start somewhere.  I mean-,2
Ses04F_impro04,53,I did start somewhere.  I worked my way up.  I'm not going to start at the bottom again.,5
Ses04F_impro04,54,Well you're going to have to.  You don't really have an option.  What's your problem?,5
Ses04F_impro04,55,What's my problem?  What's my problem? I don't have a job.,3
Ses04F_impro04,56,I don't know it's like I'm trying to be-,2
Ses04F_impro04,57,I thought I was pretty clear about what the problem was.,3
Ses04F_impro04,58,I'm trying to be helpful.,2
Ses04F_impro04,59,Well maybe you could be a little helpful.  I mean obviously you don't have any problems so would it really take so much time out of your day to just go ahead and help somebody else.,5
Ses04F_impro04,60,I'm trying to watch TV.,2
Ses04F_impro04,61,That's important.  That's really important.,5
Ses02M_script01_3,0,"I know, it went out of style, didn't it?",0
Ses02M_script01_3,1,It's all right.  It's a good thing.,0
Ses02M_script01_3,2,"You know, it's lovely here, the air is sweet.",0
Ses02M_script01_3,3,"No, not sorry.  But, um. But I'm not gonna stay.",0
Ses02M_script01_3,4,"The trouble is, I planned on sort of sneaking up on you on a period of a week or so.  But they take it for granted that we're all set.",5
Ses02M_script01_3,5,"I knew they would, your mother anyway.",0
Ses02M_script01_3,6,"Well, from her point of view, why else would I come?",2
Ses02M_script01_3,7,I guess this is why I came.,0
Ses02M_script01_3,8,I'm embarrassing you and I didn't want to tell it to you here.  I wanted some place we'd never been before.  A place where we'd be brand new to each other.,4
Ses02M_script01_3,9,"Well, you started to write me",0
Ses02M_script01_3,10,You felt something that far back?,4
Ses02M_script01_3,11,Every day since.,0
Ses02M_script01_3,12,"Ann, why didn't you let me know?",4
Ses02M_script01_3,13,Let's drive someplace.  I want to be alone with you.,1
Ses02M_script01_3,14,No.  Nothing like that.,1
Ses02M_script01_3,15,"Well, what's wrong?  I mean, even in your letters there was some--something ashamed.",1
Ses02M_script01_3,16,"Yeah, I suppose I have been.  But it's going from me.",1
Ses02M_script01_3,17,It wouldn't work this way.,1
Ses02M_script01_3,18,"Well, I lost them.",1
Ses02M_script01_3,19,Just about all.,1
Ses02M_script01_3,20,It takes some time for a guy to toss that off.  'Cause they weren't just men.,1
Ses02M_script01_3,21,"For instance, this one time, it had been raining several days and this kid came to me and gave me his last pair of dry socks.  I put them in pocket.  It's only a little thing, but those are the kind of guys I had.",1
Ses02M_script01_3,22,"They didn't die, they killed themselves for each other.  I mean that exactly.  I mean, a little more selfish and they'd have been here today.",1
