vid,utter_id,sentence,label
Ses01M_script02_1,47,They just all turned at once and they just form this line as long as the California coast.  And they just started swimming...,4
Ses01M_script02_1,48,Like some little time release fire cracker went off inside their little tiny bodies.  And they all turned as one...,4
Ses01M_script02_1,49,"And form the line and started swimming, swimming that would bring them to this point here...",4
Ses01M_script02_1,50,It's like urgency that's pure urge you know.  It's single-mindedness with no mind.,4
Ses01M_script02_1,51,"It's crazy.  Look at this, I'm giving myself goose bumps, the hairs are standing up on my arm.",4
Ses03M_script01_3,0,You're not sorry you came?,2
Ses03M_script01_3,1,No.  I'm not sorry.  But I'm not going to stay.,1
Ses03M_script01_3,2,"Look,",1
Ses03M_script01_3,3,"you saw the way that she acted and then well, I mean, you, you were acting kind of...",1
Ses03M_script01_3,4,What?,2
Ses03M_script01_3,5,"Well, I don't know, embarrassed of her since I came.",1
Ses03M_script01_3,6,"I mean, that's the reason why I asked you here.",0
Ses03M_script01_3,7,"Well,",0
Ses03M_script01_3,8,I love you.,0
Ses03M_script01_3,9,I guess that's why I came.,0
Ses03M_script01_3,10,"Look, I've been ready for a long, long time now.",0
Ses03M_script01_3,11,"Look, I almost got married two years ago.",0
Ses03M_script01_3,12,You started to write me.,0
Ses03M_script01_3,13,You felt something that far back.,0
Ses03M_script01_3,14,Every day since.,0
Ses03M_script01_3,15,"I was waiting for you Chris, I mean, till then you never wrote and then when you did what did you say?",0
Ses03M_script01_3,16,You'd always be so ambiguous.,0
Ses03M_script01_3,17,"Give me a kiss Ann, just give me...",0
Ses03M_script01_3,18,"Oh God.  Annie, I kissed Annie.  I kissed Annie.",4
Ses03M_script01_3,19,I'll never forgive you for that.,0
Ses03M_script01_3,20,"I mean,  Why did you wait all these years?  There I was sitting around and wondering if I was crazy for thinking about you.",0
Ses03M_script01_3,21,We're going to live now.  I'm going to make you so happy.,0
Ses03M_script01_3,22,Not like that you're not.,0
Ses03M_script01_3,23,"Nothing.  Hey, let's drive somewhere.  I want to be alone with you.",1
Ses03M_script01_3,24,You remember overseas I was in command of a company?,1
Ses03M_script01_3,25,Well I lost them.,1
Ses03M_script01_3,26,How many?,1
Ses03M_script01_3,27,Just about all.,1
Ses03M_script01_3,28,Geez.,1
Ses03M_script01_3,29,Takes a little while to toss that off cause they weren't just men.,1
Ses03M_script01_3,30,"For instance, one time this...it had been raining several days and this one kid, he came up to me, he gave me his last pair of dry socks, put them in my pocket.",1
Ses03M_script01_3,31,"That's just a little thing but that's the kind of guys I had.  They didn't just die, they killed themselves for each other and I mean that exactly.",1
Ses03M_script01_3,32,A little more selfish and they'd still be here today.  And I got this idea watching them go down.  See everything was being destroyed but there was one new thing that was being created.,1
Ses03M_script01_3,33,"It was a kind of responsibility, man for man.  You understand me?",1
Ses03M_script01_3,34,And to show that and to bring that onto the earth again like some sort of monument standing right behind all of us and we could feel it and it would make a difference to him.,1
Ses03M_script01_3,35,And then I came here and it was incredible.  There was no meaning in it here.  The whole thing to them was a kind of bus accident.,1
Ses03M_script01_3,36,"And I went to work with dad and that rat race again and I felt what you said, ashamed.  Somehow because nobody was changed at all.",1
Ses03M_script01_3,37,"It seemed to make a sucker out of a lot of guys.  I felt wrong to be alive.  I felt wrong to have that new checkbook,",1
Ses03M_script01_3,38,"open that new bank account, drive the new car and see the new refrigerator",1
Ses03M_script01_3,39,"cause you can take those things out of the war.  But you got to know, when you drive that car that it came out of the love that a man can have for a man and you got to be a little bit better because of that.",1
Ses03M_script01_3,40,Otherwise what you have is loot and there's blood on it.,1
Ses03M_script01_3,41,And I didn't want to take any of it and I guess that included you.,1
Ses03M_script01_3,42,And you still feel that way?,1
Ses03M_script01_3,43,"that includes me too, I mean and the money, you have right to that money.  Your father put planes up in the air, good planes and he deserves it, you should be proud of that.  A man should be paid for that.",1
Ses03M_script01_3,44,Annie I'm going to make a fortune for you.,0
Ses03M_script01_3,45,What am I going to do with a fortune?,0
Ses03M_script01_3,46,Buy some hats?,0
Ses04M_impro01,0,"Yeah, hi.  Um, look, I -- all I'm trying to do right now is renew my license plate.  That's all.  I just need to get one of those little stickers.",2
Ses04M_impro01,1,Okay.  What's the problem?,2
Ses04M_impro01,2,"And I've- I've- some lady -- I got in line.  I waited for about two hours um, and, I gave her this form",5
Ses04M_impro01,3,"that she gave to me earlier. And she said oh, I gave you the wrong one by accident.  So I was hoping I could just fill out a new one, give it to you and sort of skip this whole line business.",5
Ses04M_impro01,4,"Okay, um.  Do you have your photo ID with you?",2
Ses04M_impro01,5,"Yes, I do.",2
Ses04M_impro01,6,Okay.  This is the wrong form.  I'm sorry.,2
Ses04M_impro01,7,"This is -- okay, then just can I have the form that I need.",5
Ses04M_impro01,8,"I don't have the form.  You're going to have to go get in that line over there and they will give you the right form.  And after you fill it out, you can bring it back to me.",5
Ses04M_impro01,9,Don't you -- you don't have-,5
Ses04M_impro01,10,are you telling me you don't have a stack of them behind the desk?,5
Ses04M_impro01,11,I don't have any of,5
Ses04M_impro01,12,I don't have any of them over here.  You're gonna have to go get in that line over there.  And they will give you a copy of the form.,5
Ses04M_impro01,13,"But you're -- it's the same -- I mean, you can -- like I can't go behind your desk--",5
Ses04M_impro01,14,"Nope, I don't. I don't have-",5
Ses04M_impro01,15,or I can't go behind there- you can go behind this person's desk and just grab the form. So if you could just do that; that would help me out a lot.,5
Ses04M_impro01,16,"No, I can't. That's-",5
Ses04M_impro01,17,I'm sorry.  You have to do things the way you have to do things here.  We have rules.,5
Ses04M_impro01,18,"Look, can you please just-- --make this -- look, I look--",5
Ses04M_impro01,19,"Go get in that-- Sir-- Sir, there are people in line behind you. you need",5
Ses04M_impro01,20,look-- It's  been- it's been two hours.  Can you please just make this easier on me and just go and get the form?  It's not- it's really not,5
Ses04M_impro01,21,"I'm sorry.  I'm sorry you're having a hard time,",5
Ses04M_impro01,22,but you're gonna have to go get in  that line to,5
Ses04M_impro01,23,What if I pay you money?,5
Ses04M_impro01,24,"Can I pay you money?  Can I give you, like, twenty bucks and you'll go back there and get the form?",5
Ses04M_impro01,25,twenty bucks? Please. Go get in that line over there.,2
Ses04M_impro01,26,"Come on.  Will you please?  I just --I look, I  cannot-- --just if I --",5
Ses04M_impro01,27,"Look, I'm having a really bad day.  I'm off in twenty minutes and I just really don't need this right now, okay.",5
Ses04M_impro01,28,"I don't care, well- You're having a bad -- I just waited in line for two hours.",5
Ses04M_impro01,29,"And you're gonna have to go wait again, because that's the line you need.",5
Ses04M_impro01,30,I can't do that. It's against our rules. You can go get in that line over there or you can just go ahead and leave and come back another day.  Maybe there will be a shorter line.,5
Ses04M_impro01,31,That's all I- I just- That's all i want you to-,5
Ses04M_impro01,32,"Rules, you just have to grab a piece of paper behind from somebody's desk",5
Ses04M_impro01,33,It's not rocket science.,3
Ses04M_impro01,34,"Come -- just, please, just grab the form.  It's right over there.",5
Ses04M_impro01,35,I can't do that.,5
Ses04M_impro01,36,Why are you being such a bitch?,5
Ses04M_impro01,37,"I'm sorry, but I can't do that.",5
Ses04M_impro01,38,"Please, will you please -- will you please just grab the form?",5
Ses04M_impro01,39,So go get in the other line or leave.  Or I will have you escorted out by security.,3
Ses04M_impro01,40,Would you like to be kicked out of the D.M.V.?  You don't think that'll be a little embarrassing?,3
Ses04M_impro01,41,"Fine, which line is it?",5
Ses04M_impro01,42,The one you just came from.,5
Ses04M_impro01,43,"Okay, fine.  I'll go over there.  Thanks, a lot.  You've been really helpful.",3
Ses04M_impro01,44,Yeah.  Thank you.  Have a pleasant day.,3
Ses02F_script01_2,0,"Well, maybe he just wanted to see her again.",2
Ses02F_script01_2,1,What do you mean?  He lived next door to the girl all his life.  Why wouldn't he want to see her again?,2
Ses02F_script01_2,2,How do you know he's even thinking of it?,2
Ses02F_script01_2,3,It's got that all about it.,3
Ses02F_script01_2,4,"Well, so what?",2
Ses02F_script01_2,5,"Now, listen Kate.",2
Ses02F_script01_2,6,You can't read her mind.,2
Ses02F_script01_2,7,"Well then why is she still single?  I mean, New York is full of men.  Why isn't she married?  Probably a hundred people told her she's crazy, but she's waited.",5
Ses02F_script01_2,8,How do you know why she's waited?,2
Ses02F_script01_2,9,"She knows what I know, that's why.  She's faithful as a rock.  In my worst moments I think of her waiting and I know again that I'm right.",5
Ses02F_script01_2,10,"Look, it's a nice day.  What are we arguing for?",5
Ses02F_script01_2,11,"Well, what do you want me to do about it?",5
Ses02F_script01_2,12,I want you to act like he's coming back.  Both of you.  Don't you think I haven't noticed since she got here.  I won't stand for any nonsense.,5
Ses02F_script01_2,13,But Kate--,5
Ses02F_script01_2,14,"Because if he's not coming back, I'll kill myself.  I mean, laugh--laugh at me, but...",3
Ses02F_script01_2,15,But why did that happen the very night she came here?  She sleeps in his room and his memorial breaks to pieces.  Just look.  Look at it.,3
Ses02F_script01_2,16,Calm yourself.,5
Ses02F_script01_2,17,"Believe with me, Joe.  I can't stand all alone.",5
Ses02F_script01_2,18,Calm yourself.,5
Ses02F_script01_2,19,"Last week, a man turned up in Detroit missing longer than Larry.  I mean, you read it yourself.",5
Ses02F_script01_2,20,All right.  All right.  Calm yourself.,5
Ses02F_script01_2,21,"You, above all, have to believe.",5
Ses02F_script01_2,22,Just--just don't stop believing.,5
Ses02F_script01_2,23,What does that mean?  Me above all?,3
Ses02F_script01_2,24,Look at you.  Look at you shaking.,3
Ses02F_script01_2,25,I can't help it.,5
Ses02F_script01_2,26,What have I got to hide?  What the hell is the matter with you Kate?,3
Ses04F_script01_2,0,Why did he invite her?,3
Ses04F_script01_2,1,Why does that bother you?,2
Ses04F_script01_2,2,It's been three years.  Why all of a sudden?,3
Ses04F_script01_2,3,Well maybe- maybe he just wanted to see her again.,2
Ses04F_script01_2,4,Nobody comes seven hundred miles just to see.,5
Ses04F_script01_2,5,How do you know he's even thinking about it?,2
Ses04F_script01_2,6,"What's going on here, Joe?",3
Ses04F_script01_2,7,Listen kid.,5
Ses04F_script01_2,8,"No, line.",3
Ses04F_script01_2,9,"Uh, Then why is she still-she's not his girl, Joe",2
Ses04F_script01_2,10,"She's not his girl, Joe.  She knows she's not.",3
Ses04F_script01_2,11,You can't read her mind.,2
Ses04F_script01_2,12,Then why is she still single?  New York is full of men.  Why hasn't she married?,3
Ses04F_script01_2,13,Probably a hundred people told her she's foolish but she's waited.,3
Ses04F_script01_2,14,How do you know why she waited?,5
Ses04F_script01_2,15,Because she knows what I know that's why.  She's faithful as a rock.,3
Ses04F_script01_2,16,"In my worst moments, I think of her waiting and I know again that I'm right.",5
Ses04F_script01_2,17,Look it's a nice day.  What are we arguing for?,5
Ses04F_script01_2,18,"Nobody in this house dares take her faith away, Joe.  Strangers might but not his father, not his brother.",5
Ses04F_script01_2,19,What do you want me to do?,5
Ses04F_script01_2,20,But Kate-,5
Ses04F_script01_2,21,"Because if he's not coming back, I'll kill myself.",5
Ses04F_script01_2,22,"She goes to sleep in his room and his memorial breaks in pieces.  Look, look at it.  Joe-",3
Ses04F_script01_2,23,Calm yourself.,5
Ses04F_script01_2,24,"Believe with me, Joe.  I can't stand alone.",5
Ses04F_script01_2,25,Calm yourself.,5
Ses04F_script01_2,26,Just last week a man showed up in Detroit missing longer than Larry.  You read it yourself.,5
Ses04F_script01_2,27,Alright.  Alright.  Calm yourself.,5
Ses04F_script01_2,28,You above all have got to believe.  You.,5
Ses04F_script01_2,29,Why me above all?,5
Ses04F_script01_2,30,Just don't stop believing.,5
Ses04F_script01_2,31,"What does that mean, me above all?  Look at you.  You're shaking.",3
Ses04F_script01_2,32,I can't help it.,5
Ses04F_script01_2,33,What have I got to hide?  What the hell is matter with you Kate?,5
Ses01F_script02_2,0,"Look at this, all of the hairs are standing up on my arm.",4
Ses01F_script02_2,1,That's the wind.,2
Ses01F_script02_2,2,"Well, so, what do you think?",4
Ses01F_script02_2,3,About what?,2
Ses01F_script02_2,4,About what I was saying.,2
Ses01F_script02_2,5,"Not just me, look at all of these people.",5
Ses01F_script02_2,6,"Carla, can I ask you something?  Now, don't take this the wrong way, but are you on your period?",2
Ses01F_script02_2,7,"Don't ask me that.  I hate it when you ask me that, you always ask me that.  It's insulting.",3
Ses01F_script02_2,8,"Well then, what's bugging you?",5
Ses01F_script02_2,9,We just have different ideas of what this night is supposed to look like.,5
Ses01F_script02_2,10,"There is nothing to it; we come down here, the fish arrive, they flop around, they do their fish thing.  We go ooh, ah, look at the fish and we go home.",5
Ses01F_script02_2,11,"For God- Grow up, Augie.  The fish are not going to arrive.",3
Ses01F_script02_2,12,Why not?,5
Ses01F_script02_2,13,Because they never do.  Have they...Have they ever?,3
Ses01F_script02_2,14,We've missed them twice.,5
Ses01F_script02_2,15,Twice is every time we have tried; that's ever.,3
Ses01F_script02_2,16,They'll show up this time.,5
Ses01F_script02_2,17,I feel like my whole life is going to be spent standing on this beach with my eyes wide open and my hands clasped expectantly waiting for fish to show up.  And the fish never show up.,5
Ses01F_script02_2,18,You don't understand anything I am saying.,5
Ses01F_script02_2,19,No. Of course not.,5
Ses01F_script02_2,20,"I feel like I'm always just standing here waiting.  I feel like this night is going to be the night, but it never is.",1
Ses01F_script02_2,21,"It's just fish, it's nothing to get traumatized over.",5
Ses01F_script02_2,22,"For God's sake, this is not about fish.",3
Ses01F_script02_2,23,Okay.  I'm trying to work this backwards and pinpoint the exact moment where we took a turn for the worst here.,5
Ses01F_script02_2,24,"Okay.  So you were fine during that phone call from Marge and then dinner was okay.  And doing the dishes was fine and then I was going to take a shower and you're watching the news and you said the grunions are running tonight, do you want to go?  And I said, sure great, let's go.",2
Ses01F_script02_2,25,"Okay.  So I am putting out the pets, getting the car out of the garage.",2
Ses01F_script02_2,26,Do you remember the first year we came here?  It was like four years after we got married.,2
Ses01F_script02_2,27,"You whispered the sweetest, most intimate things to me right into my ear so I could feel them as much as hear them.  And I remember thinking, this is it.  You know, finally, I am as happy as I'm supposed to be.",0
Ses01F_script02_2,28,"It's when we were driving past that Knickerbocker Liquor Locker, you said, let's get some champagne.  I said no, time's a wasting or something like that.",2
Ses01F_script02_2,29,dancing barefoot in the sand.,5
Ses01F_script02_2,30,"That's what it is?  Right?  You want this to be like the other time, right?",5
Ses01F_script02_2,31,I'd rather not remember some things.  I'd rather not hope for some things.,1
Ses01F_script02_2,32,Sure.  All right.  Okay.,2
Ses01F_script02_2,33,"Listen, do you want to dance?",2
Ses01F_script02_2,34,No.,2
Ses01F_script02_2,35,Do you want me to go get some champagne?,2
Ses01F_script02_2,36,Do you want to take off your shoes?,0
Ses01F_script02_2,37,"No, no. Nothing.",5
Ses01F_script02_2,38,Do you want to get married again?,0
Ses01F_script02_2,39,No.,2
Ses01F_script02_2,40,No.,5
Ses01F_script02_2,41,[BREATHING],5
Ses01F_script02_2,42,"No I'm just like you.  I thought it was going to be all roses and peaches and the bills would just pay themselves.  And we'll have three, fat rosy cheeked children.  Huh, baby, the joke's on us.  Because you know what you get?",5
Ses01F_script02_2,43,Do you know what you get?  You get this.,5
Ses01F_script02_2,44,This? What is this?  This is nothing.  This isn't even anything.,5
Ses01F_script02_2,45,Yes it is.,2
Ses01F_script02_2,46,"I mean this is a lot of things, but it's just...",5
Ses01F_script02_2,47,[BREATHING],5
Ses01F_script02_2,48,Do you understand what I am saying?,5
Ses01F_script02_2,49,I'm doing the best I can.,5
Ses01F_script02_2,50,"I know you are Augie, I know.",1
Ses01F_script02_2,51,"I know you meant this to be special, I know that you wanted it to be right, but I just can't help thinking that, I can't help wishing that I was somewhere else.",1
Ses01F_script02_2,52,"Maybe if you were with someone else, too.",1
Ses01F_script02_2,53,I didn't say that.,1
Ses01F_script02_2,54,I just- I know I don't make you happy.,1
Ses01F_script02_2,55,"You're the one who probably wishes he was with somebody else.  Somebody who doesn't take things so seriously, who could enjoy herself.",1
Ses01F_script02_2,56,"You know, actually now that you mention it, no I don't.",2
Ses01F_script02_2,57,"So maybe we are in the wrong spot, but we are with the right person.",2
Ses01F_script02_2,58,"I don't know, it seemed like such a good spot to me.",5
Ses01F_script02_2,59,"We have a great view of the moon from here, though, huh?",2
Ses01F_script02_2,60,"Hmm.  I noticed that, it's pretty. Big old white moon.",0
Ses01F_script02_2,61,[BREATHING],2
Ses01F_script02_2,62,And look what I got here.,0
Ses01F_script02_2,63,"Augie, you bought refreshments.",0
Ses01F_script02_2,64,I guess we don't need glasses.,0
Ses01F_script02_2,65,[BREATHING],0
Ses01F_script02_2,66,Do you want to go home?  Are you cold?,2
Ses01F_script02_2,67,I'm beginning to think this might be the right spot after all.,0
Ses01F_script02_2,68,"Augie, I'm sorry.",1
Ses01F_script02_2,69,"Shh.  If we're very quiet, the fish might come.",2
Ses01F_script02_2,70,Or not.,2
Ses01F_script02_2,71,Or not.,0
Ses01M_impro05,0,Can I help you?,2
Ses01M_impro05,1,"Yes, please help me.  Where is my bag?",5
Ses01M_impro05,2,I need a little more information.,2
Ses01M_impro05,3,"Where is my bag?  Come on, I've been here for four hours.",5
Ses01M_impro05,4,What- What flight did you come in on?,2
Ses01M_impro05,5,"Okay, I'm coming in from Atlanta.",5
Ses01M_impro05,6,Georgia?,2
Ses01M_impro05,7,"There's no need for you to raise your voice, sir.",2
Ses01M_impro05,8,I've been college educated.,2
Ses01M_impro05,9,I speak your language.,2
Ses01M_impro05,10,Are you insinuating that I don't have a college education and that- for some reason that makes you a better person than I am?,3
Ses01M_impro05,11,"Listen, shut your smug mouth, okay?  I don't need that.",3
Ses01M_impro05,12,I'm just saying you don't need to talk to me like I-,2
Ses01M_impro05,13,I've been sitting here for four hours.,3
Ses01M_impro05,14,I'm not a child.,5
Ses01M_impro05,15,You people have just been tossing me around like a used hanky.,3
Ses01M_impro05,16,You work here.,3
Ses01M_impro05,17,"Details, Details.  Well, anyhow can I--",2
Ses01M_impro05,18,so you flew in from Atlanta...,2
Ses01M_impro05,19,My bag from Atlanta.,5
Ses01M_impro05,20,Four...Four hours ago.,2
Ses01M_impro05,21,It's a little black bag with wheels.,5
Ses01M_impro05,22,Do you have any i-?,2
Ses01M_impro05,23,I wouldn't let you?   I was not in Atlanta. I was not in Atlanta.,2
Ses01M_impro05,24,I had nothing to do with the boarding attendance.  I'm sorry that your seat was wherever it was.,2
Ses01M_impro05,25,"I have some unfortunate news, uh, that your bag isn't going to be--",2
Ses01M_impro05,26,--arriving any time soon.,2
Ses01M_impro05,27,I'm really sorry to tell you this but...,2
Ses01M_impro05,28,Okay.,2
Ses01M_impro05,29,It's not.  I can offer you fifty dollars and a reimbursement gift cards for our airline...,2
Ses01M_impro05,30,...and your future...,2
Ses01M_impro05,31,No.,2
Ses01M_impro05,32,Yes.,2
Ses01M_impro05,33,Where is it?  Where did it go?,5
Ses01M_impro05,34,We've actually...,2
Ses01M_impro05,35,They do as matter of fact.  We don't like to publicize it because,2
Ses01M_impro05,36,people wouldn't Fly our airline.,2
Ses01M_impro05,37,Probably people that work for your company huh?,3
Ses01M_impro05,38,Do you know what was in that little bag that I could have just easily put in overhead compartment but no I had to check?,3
Ses01M_impro05,39,What was that?,2
Ses01M_impro05,40,My computer which has all of my data which I'm collecting right now.,3
Ses01M_impro05,41,That's unfortunate.,2
Ses01M_impro05,42,Yeah it's really unfortunate you know why because I'm going to get fired if I don't get that.  So I need to have that back.,3
Ses01M_impro05,43,That's too bad.,2
Ses01M_impro05,44,"Fifty dollars is not going to cover me for my job, okay?",3
Ses01M_impro05,45,I wish I could give it to you.,2
Ses01M_impro05,46,Well you need to find it. Can I just go back there and look through the bags?  Can I just go back there and just go through maybe I'll find it.,3
Ses01M_impro05,47,I wish I-,2
Ses01M_impro05,48,That's not - no.,2
Ses01M_impro05,49,No.,2
Ses01M_impro05,50,It'll be a lot more than what you're doing sitting here and just give me lip service.  I'd like to go back at least do some aggressive searching for my stuff.,3
Ses01M_impro05,51,We have plenty of aggressive searching going on it's not there.  Someone's taken it.,2
Ses01M_impro05,52,"Sure, yeah right you have plenty of aggressive searching going on, aggressive searching, drinking coffee and smoking cigarettes.",3
Ses01M_impro05,53,I know what you guys do when you're not working you're union people; you just sit around on your ass.,3
Ses01M_impro05,54,You know I don't need to take this sort of abuse.,5
Ses01M_impro05,55,[BREATHING],5
Ses01M_impro05,56,Thank you very much.,3
Ses02M_script02_1,0,What time is it? They're supposed to run around midnight.,4
Ses02M_script02_1,1,"God, this great, isn't it? Like look at the night we go here, it couldn't be better.",4
Ses02M_script02_1,2,How you doing?,4
Ses02M_script02_1,3,Fine.,2
Ses02M_script02_1,4,"Is that -- is that, no? Was that just foam? I can't even tell.",4
Ses02M_script02_1,5,"Although, I guess you can't tell it probably isn't them. Probably be unmistakable don't you think?",4
Ses02M_script02_1,6,How you doing? You know what I forgot? I forgot to bring my flashlight. How - how could I forget to bring my flashlight? How could I be so stupid?,4
Ses02M_script02_1,7,What flashlight?,2
Ses02M_script02_1,8,"You know the flashlight, the silver one, there is only one, isn't there?",5
Ses02M_script02_1,9,That's not your flashlight.,5
Ses02M_script02_1,10,Who's is it?,5
Ses02M_script02_1,11,It's ours; it's mine too.,5
Ses02M_script02_1,12,But you kept saying my flashlight as if somehow it's just yours. I mean how is it supposed to make me feel?,5
Ses02M_script02_1,13,Yea.,2
Ses02M_script02_1,14,"You cold, you want my jacket? We should've - we should've brought our blanket, our blanket, how could we forget to bring the blanket?",4
Ses02M_script02_1,15,"Oh, a six-pack, that's, should've brought a -- a six-pack be just the ticket right now. How could I forget,",4
Ses02M_script02_1,16,"oh man. Like a kid, it's amazing I got out of the house with my fly zipped.",4
Ses02M_script02_1,17,You think they can hear us talk or feel the vibrations in the sand when we move around?,4
Ses02M_script02_1,18,I'm cold.,2
Ses02M_script02_1,19,It's after eleven. Let's just go home.,5
Ses02M_script02_1,20,"Are you kidding, we'd miss it. We, we just got here. What's the point in coming down here if we just turn around and go home?",5
Ses02M_script02_1,21,There is no point in coming down here.,5
Ses02M_script02_1,22,That's my point.,5
Ses02M_script02_1,23,So let's go.,5
Ses02M_script02_1,24,Not particularly.,2
Ses02M_script02_1,25,"I don't, it's just stupid.",5
Ses02M_script02_1,26,"Honey, this is a natural phenomenon. I mean it only happens once a year.",4
Ses02M_script02_1,27,"Think about the people in Kansas, they- they'd have to get a plane ticket and hotel reservations to see this. We live forty minutes away it's too good to pass up.",4
Ses02M_script02_1,28,"Pass up what? These little fish swim onto the beach flop around and swim away, and then they die.",5
Ses02M_script02_1,29,"Yea, but that moment on the beach is the highlight of their little lives. I mean all that flopping is laying eggs or what do you, mating or spotting or something like that.",4
